"game","order","displayText","source","signal","difficulty","answerLeak","moderation","status"
"The Elder Scrolls V: Skyrim Special Edition","6","Ну а если серьёзно, тут тебе скорее всего никто не поможет, потому что вряд ли кто-то играл в [название игры] с этими читами, когда есть легальный абуз, и консольные читы. Тут скорее на портал создателя сей поделки.","https://dtf.ru/id2042315/3850162-kak-vernut-normalnyy-uron-oruzhiya-v-skyrim-posle-chitov?comment=53261068","player-experience","easy","false","safe","published"
"The Elder Scrolls V: Skyrim Special Edition","","Да, видно, как у челика тогда глаза горели, неудивительно, что в этом творческом угаре он породил величайшую игру всех времён [название игры].","https://dtf.ru/games/3737709-todd-govard-i-bethesda-smotryat-dokumentalku-ob-oblivion?comment=51424283","community-humor","reserve","false","safe","reserve"
"The Elder Scrolls V: Skyrim Special Edition","","> этого все предметы, убитые враги или физические объекты остаются на месте, даже когда игрок покидает локацию. Это тоже есть?","https://dtf.ru/games/3745305-zagruzochnye-ekrany-bethesda-mnenie-dizaynera?comment=51530432","player-experience","reserve","false","safe","reserve"
"The Elder Scrolls V: Skyrim Special Edition","","Морровинд, Обла и [название игры] с мечами и магией. Те самые легендарные игры в каждой последующей из которых только урезали механики.","https://dtf.ru/games/3737709-todd-govard-i-bethesda-smotryat-dokumentalku-ob-oblivion?comment=51425771","mechanics","reserve","false","safe","reserve"
"Elden Ring","1","так наоборот же, это фанаты Бабадзаки перед каждым заходом в игру свою попу готовят","https://dtf.ru/games/3196406-eto-zhe-shutka-da-kak-v-seti-otreagirovali-na-nominaciyu-elden-ring-shadow-of-the-erdtree-na-zvanie-igry-goda?comment=45632397","player-experience","hard","false","safe","published"
"Elden Ring","2","Я уже представляю как эта хуета будет крутиться в ритме вальса, попутно опиздошивая гг. Просто ненавижу копейщиков в соулс-лайках, всем сердцем блять. Однако, где там мой кошелек...","https://dtf.ru/granger/2507051-pervyi-treiler-elden-ring-shadow-of-the-erdtree-reliz-21-iyunya-po-cene-2399-rublei?comment=35974017","player-experience","hard/medium","false","safe","published"
"Elden Ring","3","> Подача квестов у Миядзаки — один из вариантов, как убедить игрока в живости мира на экране. Мы, похоже, в разные игры играли. Более мертвого мира, чем в соулсах, еще поискать надо.","https://dtf.ru/games/2850750-nepopulyarnoe-mnenie-syuzhetnye-kvesty-v-elden-ring-luchshe-chem-v-hvalenom-baldurs-gate-3?comment=41241874","story","medium","false","safe","published"
"Elden Ring","4","Игрокам приготовиться к куче тредов с нытьем, почему [название игры], продавшийся в 20+ миллионов копий, имевший пиковый онлайн в 850к и довольно долго его державший, на самом деле плохая и никому ненужная игра.","https://dtf.ru/granger/2505642-pervyi-treiler-elden-ring-shadow-of-the-erdtree-pokazhut-21-fevralya?comment=35946739","player-experience","medium","false","safe","published"
"Elden Ring","5","Да я уже заметил. Вообще это забавно, как у каждой великой игры есть вот такие хейтеры, которые бегут быстрее высказать своё важное мнение) Я понимаю, что можно не любить [название игры] и не считать её никакой великой.","https://dtf.ru/granger/2722190-odno-iz-luchshih-dopolnenii-desyatiletiya-geimplei-skrinshoty-i-glavnoe-iz-prevyu-elden-ring-shadow-of-the-erdtree?comment=39473841","player-experience","medium/easy","false","safe","published"
"Elden Ring","6","Квесты в ER: - пойди туда, не знаю куда - найди там NPC и поговори с ним - еще раз поговори с ним - ещё раз поговори с ним, пока у него не закончатся фразы - отдохни у благодати - ещё раз поговори с NPC и получи от него квестовый предмет - догадайся, нахрена нужен этот квестовый","https://dtf.ru/games/2850750-nepopulyarnoe-mnenie-syuzhetnye-kvesty-v-elden-ring-luchshe-chem-v-hvalenom-baldurs-gate-3?comment=41254042","technical; story","easy","false","safe","published"
"Elden Ring","","Хватит скипать диалоги до секса в комментах, читай статью!","https://dtf.ru/games/2850750-nepopulyarnoe-mnenie-syuzhetnye-kvesty-v-elden-ring-luchshe-chem-v-hvalenom-baldurs-gate-3?comment=41241099","player-experience","reserve","false","safe","reserve"
"Elden Ring","","Да это все казуалы, которые не понимают гения Миядзаки. Пусть идут в свое марево прыгают или на бананы кликают. А у кого проблемы со статтерами, просто обновите свое железо, у журналистов вон все нормально было.","https://dtf.ru/steam/2760548-dopolnenie-shadow-of-the-erdtree-dlya-elden-ring-startovalo-so-smeshannyh-otzyvov-v-steam-bolshe-vsego-negativnyh-obzorov-ot-kitaiskih-igrokov?comment=40034058","player-experience","reserve","false","safe","reserve"
"Elden Ring","","Каккя соя, все нормальные люди которые поигрпли в длс в ахуе от того какое оно всратое по балансу, про финал молчу, это тупо рофл от Миядзаки.","https://dtf.ru/steam/2760548-dopolnenie-shadow-of-the-erdtree-dlya-elden-ring-startovalo-so-smeshannyh-otzyvov-v-steam-bolshe-vsego-negativnyh-obzorov-ot-kitaiskih-igrokov?comment=40034960","story","reserve","false","safe","reserve"
"Fallout 76","1","Похоже кто то давненько не запускал морру и облу. Я недавно запускал.","https://dtf.ru/gameindustry/2215795-esli-ty-sdelal-odnu-solnechnuyu-sistemu-ty-sdelal-90-raboty-dlya-sotni-byvshii-dizainer-bethesda-o-masshtabah-starfield?comment=31136061","player-experience","hard","false","safe","published"
"Fallout 76","2","> Как результат, в тайтлах Bethesda вы можете стать главой всех гильдий или лучшим другом всех компаньонов.","https://dtf.ru/gameindustry/2215795-esli-ty-sdelal-odnu-solnechnuyu-sistemu-ty-sdelal-90-raboty-dlya-sotni-byvshii-dizainer-bethesda-o-masshtabah-starfield?comment=31135200","player-experience","hard/medium","false","safe","published"
"Fallout 76","3","> Несмит признал, что в итоге исследование в Starfield вышло не таким интересным, как хотелось бы игрокам и самой Bethesda.","https://dtf.ru/gameindustry/2215795-esli-ty-sdelal-odnu-solnechnuyu-sistemu-ty-sdelal-90-raboty-dlya-sotni-byvshii-dizainer-bethesda-o-masshtabah-starfield?comment=31135150","player-experience","medium","false","safe","published"
"Fallout 76","4",">если ты сделал самый хуевый рандомайзер в видеоиграх, считай 90% игры сделано Рассказал ведущий лидер Bethesda Тодд Ховард","https://dtf.ru/gameindustry/2215795-esli-ty-sdelal-odnu-solnechnuyu-sistemu-ty-sdelal-90-raboty-dlya-sotni-byvshii-dizainer-bethesda-o-masshtabah-starfield?comment=31135278","player-experience","medium","false","safe","published"
"Concord","1",">не учли, что аудитория уже устала от однотипных геройских шутеров без изюминки Ну да, а райвалс выстрелила потому что она офигеть какая изюмистая.","https://dtf.ru/games/3339541-glavnye-razocharovaniya-2024-go-dlya-redakcii-dtf-ot-concord-do-dragon-age-the-veilguard?comment=47214200","player-experience","hard","false","safe","published"
"Concord","2","""В связи с этим игра официально не продаётся в странах, где такую учётную запись создать нельзя, например, в Казахстане."" Спасибо Sony что уберегли нас от этой игры","https://dtf.ru/games/2935256-vyshel-concord-geroiskii-pvp-shuter-ot-sony?comment=42258136","player-experience","hard/medium","false","safe","published"
"Concord","3","Имхо: могут посадить клепать ремастеры шутеров Sony от первого лица. Не могут сделать своё, пусть хоть с пользой время проводят. В них уже слишком много денег вложено было, чтобы просто увольнять. P.S.: чо, пацаны, Killzone?","https://dtf.ru/games/2965180-razrabotchikov-kaznyat-a-ne-prosto-sokratyat-kak-v-seti-otreagirovali-na-zakrytie-serverov-concord?comment=42740191","player-experience","medium","false","safe","published"
"Concord","4","Молвят, [название игры] войдёт в топ по онлайну и продажам.","https://dtf.ru/games/2954155-analitik-prodazhi-concord-sostavili-okolo-25-tysyach-kopii?comment=42579035","player-experience","medium","false","safe","published"
"Concord","5","Вот это реально смешно. Посты с шутками про барнаулцев и успех Веилгарда никто не то что не удалял, но даже в шб не отправляли. А вот стоило кому-то из пользователей написать что-то плохое про игру или про то, что у нее плохие продажи, так сразу же удаление поста.","https://dtf.ru/games/3339541-glavnye-razocharovaniya-2024-go-dlya-redakcii-dtf-ot-concord-do-dragon-age-the-veilguard?comment=47214633","community-humor","medium/easy","false","safe","published"
"Concord","6","Чет вообще не понятно, для кого [название игры] делается, очередная жвачка про каличей с абилками. Видимо, лавры Bleeding Edge покоя не дают","https://dtf.ru/games/2712175-god-of-war-ragnark-na-pk-geimplei-shutera-concord-v-duhe-overwatch-i-remeik-silent-hill-2-chto-pokazali-na-state-of-play?comment=39323457","player-experience","easy","false","safe","published"
"Concord","","Сони не делают роскошные игры со времен ПС2. [название игры] такое же мессиво как хорайзен с павуком.","https://dtf.ru/games/2942829-igroki-stali-zhalovatsya-na-vremya-ozhidaniya-matchei-v-concord-ono-dostigaet-15-minut?comment=42383534","player-experience","reserve","false","safe","reserve"
"Concord","","> Marathon не повторит ошибок [название игры] Он сделает новые.","https://dtf.ru/games/3829742-german-hulst-marathon-izbezhit-oshibok-concord?comment=52934886","player-experience","reserve","false","safe","reserve"
"Concord","","Вот он, тот самый единственный фанат [название игры], что играет в него с 300 аккаунтов.","https://dtf.ru/games/2944662-maksimalnyi-sutochnyi-onlain-concord-v-steam-opustilsya-nizhe-300-chelovek?comment=42417532","player-experience","reserve","false","safe","reserve"
"The Last of Us Part II","1","> Обозреватели назвали ремастер лучшей версией игры, которую обязательно следует опробовать всем поклонникам > Разработчики внесли лишь небольшие визуальные изменения > Многие журналисты признались, что большой разницы с обычной версией всё-таки не увидели Суууууука","https://dtf.ru/games/2429095-shedevr-stal-eshe-luchshe-ocenki-remastera-the-last-of-us-part-ii-91-ball-iz-100-na-metacritic?comment=34570593","atmosphere","hard","false","safe","published"
"The Last of Us Part II","2",">Элли и Эбби зеркальные отражения >даже имена похожи >приходят к тому, что смысла в этом круговороте насилия нет >поэтому поддерживать кого-то в этой борьбе смысла нет Блять.","https://dtf.ru/games/3712334-the-last-of-us-part-ii-obzor-i-sovety-po-igre-na-pk?comment=51039375","player-experience","hard/medium","false","safe","published"
"The Last of Us Part II","3","Всё так, сюжет субъективен но как игра супер, особенно стрельба и импакт.","https://dtf.ru/games/2429095-shedevr-stal-eshe-luchshe-ocenki-remastera-the-last-of-us-part-ii-91-ball-iz-100-na-metacritic?comment=34569356","story","medium","false","safe","published"
"The Last of Us Part II","4","Категорически не разделяю хейта ко второй части. На мой взгляд, при всех своих тараканах в голове Дракманн все-таки один из немногих, кто продвигает сингловые сюжетные высокобюджетные игры, а не дроч на вышки и цифры в красивых декорациях (наравне с Лэйком, Кодзимой и","https://dtf.ru/games/3712334-the-last-of-us-part-ii-obzor-i-sovety-po-igre-na-pk?comment=51042390","story; atmosphere","medium","false","safe","published"
"The Last of Us Part II","5","Если у тебя турбины перегреваются от того что один набор пикселей убил другой набор пикселей, то соболезнуем) А вообще игра выстроена нормально, ты ВНЕЗАПНО (если не ловить спойлеры), начинаешь играть за персонажа который намеренно выставлен антагонистом, а Дракманн начинает лить","https://dtf.ru/games/3712334-the-last-of-us-part-ii-obzor-i-sovety-po-igre-na-pk?comment=51041086","story","medium/easy","false","safe","published"
"The Last of Us Part II","6","[название игры] неиронично крутая игра, и она лучше первой части. Не набрасываю, не провоцирую, я и ещё многие люди реально так считаем","https://dtf.ru/games/2429095-shedevr-stal-eshe-luchshe-ocenki-remastera-the-last-of-us-part-ii-91-ball-iz-100-na-metacritic?comment=34569300","player-experience","easy","false","safe","published"
"The Last of Us Part II","","Самое смешное, что теперь будет игра с графикой лучше, чем у многих игр сделанных сразу под пс5.","https://dtf.ru/games/2270955-oficialno-remaster-the-last-of-us-part-ii-vyidet-19-yanvarya?comment=32156347","community-humor; atmosphere","reserve","false","safe","reserve"
"The Last of Us Part II","",">10 баксов за такое масштабное обновление игры это дорого? МАЩТАБНОЕ ОБНОВЛЕНИЕ, найди 10 отличий)","https://dtf.ru/games/2270955-oficialno-remaster-the-last-of-us-part-ii-vyidet-19-yanvarya?comment=32156888","player-experience","reserve","false","safe","reserve"
"The Last of Us Part II","","Эти новые режимы бесплатно патчами делают разрабы которые даже близко такими тиражами игры не продают. Даже у Тсусимы от той же Сони новый режим бесплатно раздавали.","https://dtf.ru/games/2270955-oficialno-remaster-the-last-of-us-part-ii-vyidet-19-yanvarya?comment=32158116","technical","reserve","false","safe","reserve"
"Bloodborne","1","Sony и FromSoftware увернулось от его предложения и ловко бэкстебнуло игнором в спину","https://dtf.ru/id63086/2876478-strimer-kai-cenat-prizval-sony-i-fromsoftware-perevypustit-bloodborne?comment=41540172","player-experience","hard","false","safe","published"
"Bloodborne","2",">В Shadow of the Erdtree появится ещё одно отравленное болото. Миядзаки заявил, что после выпуска Elden Ring провёл самоанализ и понял, что ему нравится создавать такие локации. Да кто бы блять сомневался...","https://dtf.ru/granger/2507318-eto-nashe-krupneishee-dopolnenie-v-istorii-detali-elden-ring-shadow-of-the-erdtree-ot-hidetaki-miyadzaki?comment=35977830","player-experience","hard/medium","false","safe","published"
"Bloodborne","3","Я справочная служба тебе? Открываешь реддит, протираешь глаза и смотришь посты на сабреддитах по fromsoftware и souls и делаешь выводы. Ты сам сидишь в посте про выпрашивание у разрабов порта и говоришь, что никому не надо. Найди хоть один пост про сиквел Sekiro или DS.","https://dtf.ru/games/2744612-hidetaka-miyadzaki-nazval-bloodborne-relikviei-proshlogo-kotoruyu-bylo-by-zdorovo-dat-bolshemu-kolichestvu-igrokov?comment=39790802","player-experience","medium","false","safe","published"
"Bloodborne","4","Людям хочется пройти игру в хорошем качестве и при 60 FPS, что тут плохого? Даже мне, прошедшему бладик на пс4, хочется ремастер или ремейк","https://dtf.ru/games/2744612-hidetaka-miyadzaki-nazval-bloodborne-relikviei-proshlogo-kotoruyu-bylo-by-zdorovo-dat-bolshemu-kolichestvu-igrokov?comment=39790095","technical","medium","false","safe","published"
"Bloodborne","5","не, мне поебать если честно что на сони, что на [название игры], что на конкорд, я просто интересуюсь откуда у тебя статистика","https://dtf.ru/hard/3417143-neveroyatnoe-dostizhenie-v-digital-foundry-vysoko-ocenili-rabotu-bloodborne-na-pk-cherez-shadps4?comment=47979588","player-experience","medium/easy","false","safe","published"
"Bloodborne","6","[название игры] 2 сегодня анонсируют, проверяй!","https://dtf.ru/hard/3417143-neveroyatnoe-dostizhenie-v-digital-foundry-vysoko-ocenili-rabotu-bloodborne-na-pk-cherez-shadps4?comment=47978830","release-context","easy","false","safe","published"
"Bloodborne","","А Kart уберет по запросу Nintendo. Ждем """" получается","https://dtf.ru/gameindustry/2452890-avtory-fanatskoi-bloodborne-kart-uberut-iz-igry-brending-bloodborne-po-trebovaniyu-sony?comment=35011296","player-experience","reserve","false","safe","reserve"
"Bloodborne","","Прошел ельден ринг на релизе, буквально худшая работа миядзаки.","https://dtf.ru/granger/2507318-eto-nashe-krupneishee-dopolnenie-v-istorii-detali-elden-ring-shadow-of-the-erdtree-ot-hidetaki-miyadzaki?comment=35978233","release-context","reserve","false","safe","reserve"
"Bloodborne","","Мне кажется уже всем очевидно, что они выпустят ремейк под релиз PS6. Если они уж никому не нужный DS ремейкнули, то [название игры] тем более ремейкнут.","https://dtf.ru/id63086/2876478-strimer-kai-cenat-prizval-sony-i-fromsoftware-perevypustit-bloodborne?comment=41540249","release-context","reserve","false","safe","reserve"
"No Man's Sky","1","NMS: Выпускают недоделанную игру но спустя годы всё исправляют - Вот же Шон молодец, респект. CDPR: Выпускают недоделанную игру но спустя годы всё исправляют - раньше надо было, идите дальше лохов разводите, говноделы.","https://dtf.ru/games/2824803-avtory-no-mans-sky-predstavili-masshtabnyi-apdeit-50-v-nem-polnostyu-obnovili-vselennuyu?comment=40900437","player-experience","hard","false","safe","published"
"No Man's Sky","2","NMS: Выпускают недоделанную игру но спустя 8 лет всё исправляют - всем дтфом продолжаем вспоминать отвратительный релиз. CDPR: Выпускают недоделанную игру но спустя три года решили забить болт и оставить игру в состоянии кривой поделки- молодцы, респект","https://dtf.ru/games/2824803-avtory-no-mans-sky-predstavili-masshtabnyi-apdeit-50-v-nem-polnostyu-obnovili-vselennuyu?comment=40900968","release-context","hard/medium","false","safe","published"
"No Man's Sky","3","Можно элементарно дать игроку выбор - как он хочет перемещаться: фасттревелом через загрузочный экран или ручками. Самое простое и логичное решение. Не понимаю тех, кто так яро дефает безальтернативные загрузочные экраны - это фанбойство в последней стадии.","https://dtf.ru/avi/2088655-posadka-i-vzlet-c-planet-v-starfield-elite-dangerous-star-citizen-no-mans-sky?comment=29154557","technical","medium","false","safe","published"
"No Man's Sky","4","Посмотрел когда-то видос от Internet Historian'a, где он подробно рассказал историю разработки NMS. Какой бы игра не была, но Шон и команда действительно достойны уважения","https://dtf.ru/games/1734963-dlya-no-mans-sky-vyshlo-krupnoe-obnovlenie-interceptor-v-nem-dobavili-oskvernennye-miry-i-raznoobrazili-srazheniya?comment=24132923","story; co-op","medium","false","safe","published"
"No Man's Sky","5",">[название игры] и Cyberpunk 2077 — самые известные игры, которым удалось пережить катастрофический релиз, а их разработчикам — вернуть доверие игроков.","https://dtf.ru/daniel/2336730-razrabotchiki-cyberpunk-2077-podderzhali-anons-novoi-igry-shona-myurreya-i-poshutili-chto-ee-vsegda-mozhno-ispravit-pozzhe?comment=33081815","release-context","medium/easy","false","safe","published"
"No Man's Sky","6","По сравнению с историей [название игры], исправление багов в Cyberpunk 2077 и рядом не стояло.","https://dtf.ru/daniel/2336730-razrabotchiki-cyberpunk-2077-podderzhali-anons-novoi-igry-shona-myurreya-i-poshutili-chto-ee-vsegda-mozhno-ispravit-pozzhe?comment=33082628","technical; story","easy","false","safe","published"
"No Man's Sky","","сюжет пройти, освоить язык рас, найти крутые корабли, отправлять их в экспедиции, выполнять миссии с другими игроками, вырастить свой корабль, найти поселение и сделать его классным то что в голову пришло)","https://dtf.ru/games/2824803-avtory-no-mans-sky-predstavili-masshtabnyi-apdeit-50-v-nem-polnostyu-obnovili-vselennuyu?comment=40900567","story","reserve","false","safe","reserve"
"No Man's Sky","","У Тодда буквально та же история с Фаллаут 76, не?","https://dtf.ru/games/2332162-avtory-no-mans-sky-predstavili-light-no-fire-fenteziinuyu-igru-na-planete-razmerom-s-zemlyu?comment=33008995","story","reserve","false","safe","reserve"
